"2679","Converted Paper and Paperboard Products, NEC","26","Paper and allied products","D","Manufacturing"
"2711","Newspapers:  Publishing, or Publishing and","27","Printing and publishing","D","Manufacturing"
"2721","Periodicals: Publishing, or Publishing and","27","Printing and publishing","D","Manufacturing"
"2731","Books: Publishing, or Publishing and Printing","27","Printing and publishing","D","Manufacturing"
"2732","Book Printing","27","Printing and publishing","D","Manufacturing"
"2741","Miscellaneous Publishing","27","Printing and publishing","D","Manufacturing"
"2752","Commercial Printing, Lithographic","27","Printing and publishing","D","Manufacturing"
"2754","Commercial Printing, Gravure","27","Printing and publishing","D","Manufacturing"
"2759","Commercial Printing, NEC","27","Printing and publishing","D","Manufacturing"
"2761","Manifold Business Forms","27","Printing and publishing","D","Manufacturing"
"2771","Greeting Cards","27","Printing and publishing","D","Manufacturing"
"2782","Blankbooks, Loose-leaf Binders and Devices","27","Printing and publishing","D","Manufacturing"
"2789","Bookbinding and Related Work","27","Printing and publishing","D","Manufacturing"
"2791","Typesetting","27","Printing and publishing","D","Manufacturing"
"2796","Platemaking and Related Services","27","Printing and publishing","D","Manufacturing"
"2812","Alkalies and Chlorine","28","Chemicals and allied products","D","Manufacturing"
"2813","Industrial Gases","28","Chemicals and allied products","D","Manufacturing"
"2816","Inorganic Pigments","28","Chemicals and allied products","D","Manufacturing"
"2819","Industrial Inorganic Chemicals, NEC","28","Chemicals and allied products","D","Manufacturing"
"2821","Plastics Material and Synthetic Resins, and","28","Chemicals and allied products","D","Manufacturing"
"2822","Synthetic Rubber","28","Chemicals and allied products","D","Manufacturing"
"2823","Cellulosic Manmade Fibers","28","Chemicals and allied products","D","Manufacturing"
"2824","Manmade Organic Fibers, Except Cellulosic","28","Chemicals and allied products","D","Manufacturing"
"2833","Medicinal Chemicals and Botanical Products","28","Chemicals and allied products","D","Manufacturing"
"2834","Pharmaceutical Preparations","28","Chemicals and allied products","D","Manufacturing"
"2835","In Vitro and In Vivo Diagnostic Substances","28","Chemicals and allied products","D","Manufacturing"
"2836","Biological Products, Except Diagnostic","28","Chemicals and allied products","D","Manufacturing"
"2841","Soaps and Other Detergents, Except Speciality","28","Chemicals and allied products","D","Manufacturing"
"2842","Speciality Cleaning, Polishing, and Sanitary","28","Chemicals and allied products","D","Manufacturing"
"2843","Surface Active Agents, Finishing Agents,","28","Chemicals and allied products","D","Manufacturing"
"2844","Perfumes, Cosmetics, and Other Toilet","28","Chemicals and allied products","D","Manufacturing"
"2851","Paints, Varnishes, Lacquers, Enamels, and","28","Chemicals and allied products","D","Manufacturing"
"2861","Gum and Wood Chemicals","28","Chemicals and allied products","D","Manufacturing"
"2865","Cyclic Organic Crudes and Intermediates, and","28","Chemicals and allied products","D","Manufacturing"
"2869","Industrial Organic Chemicals, NEC","28","Chemicals and allied products","D","Manufacturing"
"2873","Nitrogenous Fertilizers","28","Chemicals and allied products","D","Manufacturing"
"2874","Phosphatic Fertilizers","28","Chemicals and allied products","D","Manufacturing"
"2875","Fertilizers, Mixing Only","28","Chemicals and allied products","D","Manufacturing"
"2879","Pesticides and Agricultural Chemicals, NEC","28","Chemicals and allied products","D","Manufacturing"
"2891","Adhesives and Sealants","28","Chemicals and allied products","D","Manufacturing"
"2892","Explosives","28","Chemicals and allied products","D","Manufacturing"
"2893","Printing Ink","28","Chemicals and allied products","D","Manufacturing"
"2895","Carbon Black","28","Chemicals and allied products","D","Manufacturing"
"2899","Chemicals and Chemical Preparations, NEC","28","Chemicals and allied products","D","Manufacturing"
"2911","Petroleum Refining","29","Petroleum and coal products","D","Manufacturing"
"2951","Asphalt Paving Mixtures and Blocks","29","Petroleum and coal products","D","Manufacturing"
"2952","Asphalt Felts and Coatings","29","Petroleum and coal products","D","Manufacturing"
"2992","Lubricating Oils and Greases","29","Petroleum and coal products","D","Manufacturing"
"2999","Products of Petroleum and Coal, NEC","29","Petroleum and coal products","D","Manufacturing"
"3011","Tires and Inner Tubes","30","Rubber and miscellaneous plastics products","D","Manufacturing"
"3021","Rubber and Plastics Footwear","30","Rubber and miscellaneous plastics products","D","Manufacturing"
"3052","Rubber and Plastics Hose and Belting","30","Rubber and miscellaneous plastics products","D","Manufacturing"
"3053","Gaskets, Packing, and Sealing Devices","30","Rubber and miscellaneous plastics products","D","Manufacturing"
"3061","Molded, Extruded, and Lathe-Cut Mechanical","30","Rubber and miscellaneous plastics products","D","Manufacturing"
"3069","Fabricated Rubber Products, NEC","30","Rubber and miscellaneous plastics products","D","Manufacturing"
"3081","Unsupported Plastics Film and Sheet","30","Rubber and miscellaneous plastics products","D","Manufacturing"
"3082","Unsupported Plastics Profile Shapes","30","Rubber and miscellaneous plastics products","D","Manufacturing"
"3083","Laminated Plastics Plate, Sheet, and Profile","30","Rubber and miscellaneous plastics products","D","Manufacturing"
"3084","Plastics Pipe","30","Rubber and miscellaneous plastics products","D","Manufacturing"
"3085","Plastics Bottles","30","Rubber and miscellaneous plastics products","D","Manufacturing"
"3086","Plastics Foam Products","30","Rubber and miscellaneous plastics products","D","Manufacturing"
"3087","Custom Compounding of Purchased Plastics","30","Rubber and miscellaneous plastics products","D","Manufacturing"
"3088","Plastics Plumbing Fixtures","30","Rubber and miscellaneous plastics products","D","Manufacturing"
"3089","Plastics Products, NEC","30","Rubber and miscellaneous plastics products","D","Manufacturing"
"3111","Leather Tanning and Finishing","31","Leather and leather products","D","Manufacturing"
"3131","Boot and Shoe Cut Stock and Findings","31","Leather and leather products","D","Manufacturing"
"3142","House Slippers","31","Leather and leather products","D","Manufacturing"
"3143","Men's Footwear, Except Athletic","31","Leather and leather products","D","Manufacturing"
"3144","Women's Footwear, Except Athletic","31","Leather and leather products","D","Manufacturing"
"3149","Footwear, Except Rubber, NEC","31","Leather and leather products","D","Manufacturing"
"3151","Leather Gloves and Mittens","31","Leather and leather products","D","Manufacturing"
"3161","Luggage","31","Leather and leather products","D","Manufacturing"
"3171","Women's Handbags and Purses","31","Leather and leather products","D","Manufacturing"
"3172","Personal Leather Goods, Except Women's","31","Leather and leather products","D","Manufacturing"
"3199","Leather Goods, NEC","31","Leather and leather products","D","Manufacturing"
"3211","Flat Glass","32","Stone, clay, glass, and concrete products","D","Manufacturing"
"3221","Glass Containers","32","Stone, clay, glass, and concrete products","D","Manufacturing"
"3229","Pressed and Blown Glass and Glassware, NEC","32","Stone, clay, glass, and concrete products","D","Manufacturing"
"3231","Glass Products, Made of Purchased Glass","32","Stone, clay, glass, and concrete products","D","Manufacturing"
"3241","Cement, Hydraulic","32","Stone, clay, glass, and concrete products","D","Manufacturing"
"3251","Brick and Structural Clay Tile","32","Stone, clay, glass, and concrete products","D","Manufacturing"
"3253","Ceramic Wall and Floor Tile","32","Stone, clay, glass, and concrete products","D","Manufacturing"
"3255","Clay Refractories","32","Stone, clay, glass, and concrete products","D","Manufacturing"
"3259","Structural Clay Products, NEC","32","Stone, clay, glass, and concrete products","D","Manufacturing"
"3261","Vitreous China Plumbing Fixtures and China","32","Stone, clay, glass, and concrete products","D","Manufacturing"
"3262","Vitreous China Table and Kitchen Articles","32","Stone, clay, glass, and concrete products","D","Manufacturing"
"3263","Fine Earthenware (Whiteware) Table and","32","Stone, clay, glass, and concrete products","D","Manufacturing"
"3264","Porcelain Electrical Supplies","32","Stone, clay, glass, and concrete products","D","Manufacturing"
"3269","Pottery Products, NEC","32","Stone, clay, glass, and concrete products","D","Manufacturing"
"3271","Concrete Block and Brick","32","Stone, clay, glass, and concrete products","D","Manufacturing"
"3272","Concrete Products, Except Block and Brick","32","Stone, clay, glass, and concrete products","D","Manufacturing"
"3273","Ready-Mixed Concrete","32","Stone, clay, glass, and concrete products","D","Manufacturing"
"3274","Lime","32","Stone, clay, glass, and concrete products","D","Manufacturing"
"3275","Gypsum Products","32","Stone, clay, glass, and concrete products","D","Manufacturing"
"3281","Cut Stone and Stone Products","32","Stone, clay, glass, and concrete products","D","Manufacturing"
"3291","Abrasive Products","32","Stone, clay, glass, and concrete products","D","Manufacturing"
"3292","Asbestos Products","32","Stone, clay, glass, and concrete products","D","Manufacturing"
"3295","Minerals and Earths, Ground or Otherwise","32","Stone, clay, glass, and concrete products","D","Manufacturing"
"3296","Mineral Wool","32","Stone, clay, glass, and concrete products","D","Manufacturing"
"3297","Nonclay Refractories","32","Stone, clay, glass, and concrete products","D","Manufacturing"
"3299","Nonmetallic Mineral Products, NEC","32","Stone, clay, glass, and concrete products","D","Manufacturing"
"3312","Steel Works, Blast Furnaces (Including Coke","33","Primary metal industries","D","Manufacturing"
"3313","Electrometallurgical Products, Except Steel","33","Primary metal industries","D","Manufacturing"
"3315","Steel Wiredrawing and Steel Nails and Spikes","33","Primary metal industries","D","Manufacturing"
"3316","Cold-Rolled Steel Sheet, Strip, and Bars","33","Primary metal industries","D","Manufacturing"
"3317","Steel Pipe and Tubes","33","Primary metal industries","D","Manufacturing"
"3321","Gray and Ductile Iron Foundries","33","Primary metal industries","D","Manufacturing"
"3322","Malleable Iron Foundries","33","Primary metal industries","D","Manufacturing"
"3324","Steel Investment Foundries","33","Primary metal industries","D","Manufacturing"
"3325","Steel Foundries, NEC","33","Primary metal industries","D","Manufacturing"
"3331","Primary Smelting and Refining of Copper","33","Primary metal industries","D","Manufacturing"
"3334","Primary Production of Aluminum","33","Primary metal industries","D","Manufacturing"
"3339","Primary Smelting and Refining of Nonferrous","33","Primary metal industries","D","Manufacturing"
"3341","Secondary Smelting and Refining of Nonferrous","33","Primary metal industries","D","Manufacturing"
"3351","Rolling, Drawing, and Extruding of Copper","33","Primary metal industries","D","Manufacturing"
"3353","Aluminum Sheet, Plate, and Foil","33","Primary metal industries","D","Manufacturing"
"3354","Aluminum Extruded Products","33","Primary metal industries","D","Manufacturing"
"3355","Aluminum Rolling and Drawing, NEC","33","Primary metal industries","D","Manufacturing"
"3356","Rolling, Drawing, and Extruding of Nonferrous","33","Primary metal industries","D","Manufacturing"
"3357","Drawing and Insulating of Nonferrous Wire","33","Primary metal industries","D","Manufacturing"
"3363","Aluminum Die-Castings","33","Primary metal industries","D","Manufacturing"
"3364","Nonferrous Die-Castings, Except Aluminum","33","Primary metal industries","D","Manufacturing"
"3365","Aluminum Foundries","33","Primary metal industries","D","Manufacturing"
"3366","Copper Foundries","33","Primary metal industries","D","Manufacturing"
"3369","Nonferrous Foundries, Except Aluminum and","33","Primary metal industries","D","Manufacturing"
"3398","Metal Heat Treating","33","Primary metal industries","D","Manufacturing"
"3399","Primary Metal Products, NEC","33","Primary metal industries","D","Manufacturing"
"3411","Metal Cans","34","Fabricated metal products","D","Manufacturing"
"3412","Metal Shipping Barrels, Drums, Kegs, and","34","Fabricated metal products","D","Manufacturing"
"3421","Cutlery","34","Fabricated metal products","D","Manufacturing"
"3423","Hand and Edge Tools, Except Machine Tools and","34","Fabricated metal products","D","Manufacturing"
"3425","Saw Blades and Handsaws","34","Fabricated metal products","D","Manufacturing"
"3429","Hardware, NEC","34","Fabricated metal products","D","Manufacturing"
"3431","Enameled Iron and Metal Sanitary Ware","34","Fabricated metal products","D","Manufacturing"
"3432","Plumbing Fixture Fittings and Trim","34","Fabricated metal products","D","Manufacturing"
"3433","Heating Equipment, Except Electric and Warm","34","Fabricated metal products","D","Manufacturing"
"3441","Fabricated Structural Metal","34","Fabricated metal products","D","Manufacturing"
"3442","Metal Doors, Sash, Frames, Molding, and Trim","34","Fabricated metal products","D","Manufacturing"
"3443","Fabricated Plate Work (Boiler Shops)","34","Fabricated metal products","D","Manufacturing"
"3444","Sheet Metal Work","34","Fabricated metal products","D","Manufacturing"
"3446","Architectural and Ornamental Metal Work","34","Fabricated metal products","D","Manufacturing"
"3448","Prefabricated Metal Buildings and Components","34","Fabricated metal products","D","Manufacturing"
"3449","Miscellaneous Structural Metal Work","34","Fabricated metal products","D","Manufacturing"
"3451","Screw Machine Products","34","Fabricated metal products","D","Manufacturing"
"3452","Bolts, Nuts, Screws, Rivets, and Washers","34","Fabricated metal products","D","Manufacturing"
"3462","Iron and Steel Forgings","34","Fabricated metal products","D","Manufacturing"
"3463","Nonferrous Forgings","34","Fabricated metal products","D","Manufacturing"
"3465","Automotive Stamping","34","Fabricated metal products","D","Manufacturing"
"3466","Crowns and Closures","34","Fabricated metal products","D","Manufacturing"
"3469","Metal Stamping, NEC","34","Fabricated metal products","D","Manufacturing"
"3471","Electroplating, Plating, Polishing,","34","Fabricated metal products","D","Manufacturing"
"3479","Coating, Engraving, and Allied Services, NEC","34","Fabricated metal products","D","Manufacturing"
"3482","Small Arms Ammunition","34","Fabricated metal products","D","Manufacturing"
"3483","Ammunition, Except for Small Arms","34","Fabricated metal products","D","Manufacturing"
"3484","Small Arms","34","Fabricated metal products","D","Manufacturing"
"3489","Ordnance and Accessories, NEC","34","Fabricated metal products","D","Manufacturing"
"3491","Industrial Valves","34","Fabricated metal products","D","Manufacturing"
"3492","Fluid Power Valves and Hose Fittings","34","Fabricated metal products","D","Manufacturing"
"3493","Steel Springs, Except Wire","34","Fabricated metal products","D","Manufacturing"
"3494","Valves and Pipe Fittings, NEC","34","Fabricated metal products","D","Manufacturing"
"3495","Wire Springs","34","Fabricated metal products","D","Manufacturing"
"3496","Miscellaneous Fabricated Wire Products","34","Fabricated metal products","D","Manufacturing"
"3497","Metal Foil and Leaf","34","Fabricated metal products","D","Manufacturing"
"3498","Fabricated Pipe and Pipe Fittings","34","Fabricated metal products","D","Manufacturing"
"3499","Fabricated Metal Products, NEC","34","Fabricated metal products","D","Manufacturing"
"3511","Steam, Gas, and Hydraulic Turbines, and","35","Industrial machinery and equipment","D","Manufacturing"
"3519","Internal Combustion Engines, NEC","35","Industrial machinery and equipment","D","Manufacturing"
"3523","Farm Machinery and Equipment","35","Industrial machinery and equipment","D","Manufacturing"
"3524","Lawn and Garden Tractors and Home Lawn and","35","Industrial machinery and equipment","D","Manufacturing"
"3531","Construction Machinery and Equipment","35","Industrial machinery and equipment","D","Manufacturing"
"3532","Mining Machinery and Equipment, Except Oil","35","Industrial machinery and equipment","D","Manufacturing"
"3533","Oil and Gas Field Machinery and Equipment","35","Industrial machinery and equipment","D","Manufacturing"
"3534","Elevators and Moving Stairways","35","Industrial machinery and equipment","D","Manufacturing"
"3535","Conveyors and Conveying Equipment","35","Industrial machinery and equipment","D","Manufacturing"
"3536","Overhead Traveling Cranes, Hoists, and","35","Industrial machinery and equipment","D","Manufacturing"
"3537","Industrial Trucks, Tractors, Trailers, and","35","Industrial machinery and equipment","D","Manufacturing"
"3541","Machine Tools,  Metal Cutting Type","35","Industrial machinery and equipment","D","Manufacturing"
"3542","Machine Tools, Metal Forming Type","35","Industrial machinery and equipment","D","Manufacturing"
"3543","Industrial Patterns","35","Industrial machinery and equipment","D","Manufacturing"
"3544","Special Dies and Tools, Die Sets, Jigs and","35","Industrial machinery and equipment","D","Manufacturing"
"3545","Cutting Tools, Machine Tool Accessories, and","35","Industrial machinery and equipment","D","Manufacturing"
"3546","Power-Driven Handtools","35","Industrial machinery and equipment","D","Manufacturing"
"3547","Rolling Mill Machinery and Equipment","35","Industrial machinery and equipment","D","Manufacturing"
"3548","Electric and Gas Welding and Soldering","35","Industrial machinery and equipment","D","Manufacturing"
"3549","Metalworking Machinery, NEC","35","Industrial machinery and equipment","D","Manufacturing"
"3552","Textile Machinery","35","Industrial machinery and equipment","D","Manufacturing"
"3553","Woodworking Machinery","35","Industrial machinery and equipment","D","Manufacturing"
"3554","Paper Industries Machinery","35","Industrial machinery and equipment","D","Manufacturing"
"3555","Printing Trades Machinery and Equipment","35","Industrial machinery and equipment","D","Manufacturing"
"3556","Food Products Machinery","35","Industrial machinery and equipment","D","Manufacturing"
"3559","Special  Industry Machinery, NEC","35","Industrial machinery and equipment","D","Manufacturing"
"3561","Pumps and Pumping Equipment","35","Industrial machinery and equipment","D","Manufacturing"
"3562","Ball and Roller Bearings","35","Industrial machinery and equipment","D","Manufacturing"
"3563","Air and Gas Compressors","35","Industrial machinery and equipment","D","Manufacturing"
"3564","Industrial and Commercial Fans and Blowers","35","Industrial machinery and equipment","D","Manufacturing"
"3565","Packaging Machinery","35","Industrial machinery and equipment","D","Manufacturing"
"3566","Speed Changers, Industrial High-Speed Drives,","35","Industrial machinery and equipment","D","Manufacturing"
"3567","Industrial Process Furnaces and Ovens","35","Industrial machinery and equipment","D","Manufacturing"
"3568","Mechanical Power Transmission Equipment, NEC","35","Industrial machinery and equipment","D","Manufacturing"
"3569","General Industrial Machinery and Equipment,","35","Industrial machinery and equipment","D","Manufacturing"
"3571","Electronic Computers","35","Industrial machinery and equipment","D","Manufacturing"
"3572","Computer Storage Devices","35","Industrial machinery and equipment","D","Manufacturing"
"3575","Computer Terminals","35","Industrial machinery and equipment","D","Manufacturing"
"3577","Computer Peripheral Equipment, NEC","35","Industrial machinery and equipment","D","Manufacturing"
"3578","Calculating and Accounting Machines, Except","35","Industrial machinery and equipment","D","Manufacturing"
"3579","Office Machines, NEC","35","Industrial machinery and equipment","D","Manufacturing"
"3581","Automatic Vending Machines","35","Industrial machinery and equipment","D","Manufacturing"
"3582","Commercial Laundry, Drycleaning, and Pressing","35","Industrial machinery and equipment","D","Manufacturing"
"3585","Air-Conditioning and Warm Air Heating","35","Industrial machinery and equipment","D","Manufacturing"
"3586","Measuring and Dispensing Pumps","35","Industrial machinery and equipment","D","Manufacturing"
"3589","Service Industry Machinery, NEC","35","Industrial machinery and equipment","D","Manufacturing"
"3592","Carburetors, Pistons, Piston Rings, and","35","Industrial machinery and equipment","D","Manufacturing"
"3593","Fluid Power Cylinders and Actuators","35","Industrial machinery and equipment","D","Manufacturing"
"3594","Fluid Power Pumps and Motors","35","Industrial machinery and equipment","D","Manufacturing"
"3596","Scales and Balances, Except Laboratory","35","Industrial machinery and equipment","D","Manufacturing"
"3599","Industrial and Commercial Machinery and","35","Industrial machinery and equipment","D","Manufacturing"
"3612","Power, Distribution, and Specialty","36","Electrical and electronic equipment","D","Manufacturing"
"3613","Switchgear and Switchboard Apparatus","36","Electrical and electronic equipment","D","Manufacturing"
"3621","Motors and Generators","36","Electrical and electronic equipment","D","Manufacturing"
"3624","Carbon and Graphite Products","36","Electrical and electronic equipment","D","Manufacturing"
"3625","Relays and Industrial Controls","36","Electrical and electronic equipment","D","Manufacturing"
"3629","Electrical Industrial Apparatus, NEC","36","Electrical and electronic equipment","D","Manufacturing"
"3631","Household Cooking Equipment","36","Electrical and electronic equipment","D","Manufacturing"
"3632","Household Refrigerators and Home and Farm","36","Electrical and electronic equipment","D","Manufacturing"
"3633","Household Laundry Equipment","36","Electrical and electronic equipment","D","Manufacturing"
"3634","Electric Housewares and Fans","36","Electrical and electronic equipment","D","Manufacturing"
"3635","Household Vacuum Cleaners","36","Electrical and electronic equipment","D","Manufacturing"
"3639","Household Appliances, NEC","36","Electrical and electronic equipment","D","Manufacturing"
"3641","Electric Lamp Bulbs and Tubes","36","Electrical and electronic equipment","D","Manufacturing"
"3643","Current-Carrying Wiring Devices","36","Electrical and electronic equipment","D","Manufacturing"
"3644","Noncurrent-Carrying Wiring Devices","36","Electrical and electronic equipment","D","Manufacturing"
"3645","Residential Electric Lighting Fixtures","36","Electrical and electronic equipment","D","Manufacturing"
"3646","Commercial, Industrial, and Institutional","36","Electrical and electronic equipment","D","Manufacturing"
"3647","Vehicular Lighting Equipment","36","Electrical and electronic equipment","D","Manufacturing"
"3648","Lighting Equipment, NEC","36","Electrical and electronic equipment","D","Manufacturing"
"3651","Household Audio and Video Equipment","36","Electrical and electronic equipment","D","Manufacturing"
"3652","Phonograph Records and Prerecorded Audio","36","Electrical and electronic equipment","D","Manufacturing"
"3661","Telephone and Telegraph Apparatus","36","Electrical and electronic equipment","D","Manufacturing"
"3663","Radio and Television Broadcasting and","36","Electrical and electronic equipment","D","Manufacturing"
"3669","Communications Equipment, NEC","36","Electrical and electronic equipment","D","Manufacturing"
"3671","Electron Tubes","36","Electrical and electronic equipment","D","Manufacturing"
"3672","Printed Circuit Boards","36","Electrical and electronic equipment","D","Manufacturing"
"3674","Semiconductors and Related Devices","36","Electrical and electronic equipment","D","Manufacturing"
"3675","Electronic Capacitors","36","Electrical and electronic equipment","D","Manufacturing"
"3676","Electronic Resistors","36","Electrical and electronic equipment","D","Manufacturing"
"3677","Electronic Coils, Transformers, and Other","36","Electrical and electronic equipment","D","Manufacturing"
"3678","Electronic Connectors","36","Electrical and electronic equipment","D","Manufacturing"
"3679","Electronic Components, NEC","36","Electrical and electronic equipment","D","Manufacturing"
"3691","Storage Batteries","36","Electrical and electronic equipment","D","Manufacturing"
"3692","Primary Batteries, Dry and Wet","36","Electrical and electronic equipment","D","Manufacturing"
"3694","Electrical Equipment for Internal Combustion","36","Electrical and electronic equipment","D","Manufacturing"
"3695","Magnetic and Optical Recording Media","36","Electrical and electronic equipment","D","Manufacturing"
"3699","Electrical Machinery, Equipment, and","36","Electrical and electronic equipment","D","Manufacturing"
"3711","Motor Vehicles and Passenger Car Bodies","37","Transportation equipment","D","Manufacturing"
"3713","Truck and Bus Bodies","37","Transportation equipment","D","Manufacturing"
"3714","Motor Vehicle Parts and Accessories","37","Transportation equipment","D","Manufacturing"
"3715","Truck Trailers","37","Transportation equipment","D","Manufacturing"
"3716","Motor  Homes","37","Transportation equipment","D","Manufacturing"
"3721","Aircraft","37","Transportation equipment","D","Manufacturing"
"3724","Aircraft Engines and Engine Parts","37","Transportation equipment","D","Manufacturing"
