"SIC87_4","Desc_4_Digit","SIC87_2","Desc_2_Digit","SIC87_1","Desc_1_Digit"
"0111","Wheat","01","Agricultural production- crops","A","Agriculture, Forestry, And Fishing"
"0112","Rice","01","Agricultural production- crops","A","Agriculture, Forestry, And Fishing"
"0115","Corn","01","Agricultural production- crops","A","Agriculture, Forestry, And Fishing"
"0116","Soybeans","01","Agricultural production- crops","A","Agriculture, Forestry, And Fishing"
"0119","Cash Grains, NEC","01","Agricultural production- crops","A","Agriculture, Forestry, And Fishing"
"0131","Cotton","01","Agricultural production- crops","A","Agriculture, Forestry, And Fishing"
"0132","Tobacco","01","Agricultural production- crops","A","Agriculture, Forestry, And Fishing"
"0133","Sugarcane and Sugar Beets","01","Agricultural production- crops","A","Agriculture, Forestry, And Fishing"
"0134","Irish Potatoes","01","Agricultural production- crops","A","Agriculture, Forestry, And Fishing"
"0139","Field Crops, Except Cash Grains, NEC","01","Agricultural production- crops","A","Agriculture, Forestry, And Fishing"
"0161","Vegetables and Melons","01","Agricultural production- crops","A","Agriculture, Forestry, And Fishing"
"0171","Berry Crops","01","Agricultural production- crops","A","Agriculture, Forestry, And Fishing"
"0172","Grapes","01","Agricultural production- crops","A","Agriculture, Forestry, And Fishing"
"0173","Tree Nuts","01","Agricultural production- crops","A","Agriculture, Forestry, And Fishing"
"0174","Citrus Fruits","01","Agricultural production- crops","A","Agriculture, Forestry, And Fishing"
"0175","Deciduous Tree Fruits","01","Agricultural production- crops","A","Agriculture, Forestry, And Fishing"
"0179","Fruits and Tree Nuts, NEC","01","Agricultural production- crops","A","Agriculture, Forestry, And Fishing"
"0181","Ornamental Floriculture and Nursery Products","01","Agricultural production- crops","A","Agriculture, Forestry, And Fishing"
"0182","Food Crops Grown Under Cover","01","Agricultural production- crops","A","Agriculture, Forestry, And Fishing"
"0191","General Farms, Primarily Crop","01","Agricultural production- crops","A","Agriculture, Forestry, And Fishing"
"0211","Beef Cattle Feedlots","02","Agricultural production- livestock","A","Agriculture, Forestry, And Fishing"
"0212","Beef Cattle, Except Feedlots","02","Agricultural production- livestock","A","Agriculture, Forestry, And Fishing"
"0213","Hogs","02","Agricultural production- livestock","A","Agriculture, Forestry, And Fishing"
"0214","Sheep and Goats","02","Agricultural production- livestock","A","Agriculture, Forestry, And Fishing"
"0219","General Livestock,  Except Dairy and Poultry","02","Agricultural production- livestock","A","Agriculture, Forestry, And Fishing"
"0241","Dairy Farms","02","Agricultural production- livestock","A","Agriculture, Forestry, And Fishing"
"0251","Broiler, Fryers, and Roaster Chickens","02","Agricultural production- livestock","A","Agriculture, Forestry, And Fishing"
"0252","Chicken Eggs","02","Agricultural production- livestock","A","Agriculture, Forestry, And Fishing"
"0253","Turkey and Turkey Eggs","02","Agricultural production- livestock","A","Agriculture, Forestry, And Fishing"
"0254","Poultry Hatcheries","02","Agricultural production- livestock","A","Agriculture, Forestry, And Fishing"
"0259","Poultry and Eggs, NEC","02","Agricultural production- livestock","A","Agriculture, Forestry, And Fishing"
"0271","Fur-Bearing Animals and Rabbits","02","Agricultural production- livestock","A","Agriculture, Forestry, And Fishing"
"0272","Horses and Other Equines","02","Agricultural production- livestock","A","Agriculture, Forestry, And Fishing"
"0273","Animal Aquaculture","02","Agricultural production- livestock","A","Agriculture, Forestry, And Fishing"
"0279","Animal Specialities, NEC","02","Agricultural production- livestock","A","Agriculture, Forestry, And Fishing"
"0291","General Farms, Primarily Livestock and Animal","02","Agricultural production- livestock","A","Agriculture, Forestry, And Fishing"
"0711","Soil Preparation Services","07","Agricultural services","A","Agriculture, Forestry, And Fishing"
"0721","Crop Planting, Cultivating, and Protecting","07","Agricultural services","A","Agriculture, Forestry, And Fishing"
"0722","Crop Harvesting, Primarily by Machine","07","Agricultural services","A","Agriculture, Forestry, And Fishing"
"0723","Crop Preparation Services For Market, except","07","Agricultural services","A","Agriculture, Forestry, And Fishing"
"0724","Cotton Ginning","07","Agricultural services","A","Agriculture, Forestry, And Fishing"
"0741","Veterinary Services For Livestock","07","Agricultural services","A","Agriculture, Forestry, And Fishing"
"0742","Veterinary Services for Animal Specialties","07","Agricultural services","A","Agriculture, Forestry, And Fishing"
"0751","Livestock Services, Except Veterinary","07","Agricultural services","A","Agriculture, Forestry, And Fishing"
"0752","Animal Specialty Services, Except Veterinary","07","Agricultural services","A","Agriculture, Forestry, And Fishing"
"0761","Farm Labor Contractors and Crew Leaders","07","Agricultural services","A","Agriculture, Forestry, And Fishing"
"0762","Farm Management Services","07","Agricultural services","A","Agriculture, Forestry, And Fishing"
"0781","Landscape Counseling and Planning","07","Agricultural services","A","Agriculture, Forestry, And Fishing"
"0782","Lawn and Garden Services","07","Agricultural services","A","Agriculture, Forestry, And Fishing"
"0783","Ornamental Shrub and Tree Services","07","Agricultural services","A","Agriculture, Forestry, And Fishing"
"0811","Timber Tracts","08","Forestry","A","Agriculture, Forestry, And Fishing"
"0831","Forest Nurseries and Gathering of Forest","08","Forestry","A","Agriculture, Forestry, And Fishing"
"0851","Forestry Services","08","Forestry","A","Agriculture, Forestry, And Fishing"
"0912","Finfish","09","Fishing, hunting, and trapping","A","Agriculture, Forestry, And Fishing"
"0913","Shellfish","09","Fishing, hunting, and trapping","A","Agriculture, Forestry, And Fishing"
"0919","Miscellaneous Marine Products","09","Fishing, hunting, and trapping","A","Agriculture, Forestry, And Fishing"
"0921","Fish Hatcheries and Preserves","09","Fishing, hunting, and trapping","A","Agriculture, Forestry, And Fishing"
"0971","Hunting and Trapping, and Game Propagation","09","Fishing, hunting, and trapping","A","Agriculture, Forestry, And Fishing"
"1011","Iron Ores","10","Metal mining","B","Mining"
"1021","Copper Ores","10","Metal mining","B","Mining"
"1031","Lead and Zinc Ores","10","Metal mining","B","Mining"
"1041","Gold Ores","10","Metal mining","B","Mining"
"1044","Silver Ores","10","Metal mining","B","Mining"
"1061","Ferroalloy Ores, Except Vanadium","10","Metal mining","B","Mining"
"1081","Metal Mining Services","10","Metal mining","B","Mining"
"1094","Uranium-Radium-Vanadium Ores","10","Metal mining","B","Mining"
"1099","Miscellaneous Metal Ores, NEC","10","Metal mining","B","Mining"
"1221","Bituminous Coal and Lignite Surface Mining","12","Coal mining","B","Mining"
"1222","Bituminous Coal Underground Mining","12","Coal mining","B","Mining"
"1231","Anthracite Mining","12","Coal mining","B","Mining"
"1241","Coal Mining Services","12","Coal mining","B","Mining"
"1311","Crude Petroleum and Natural Gas","13","Oil and gas extraction","B","Mining"
"1321","Natural Gas Liquids","13","Oil and gas extraction","B","Mining"
"1381","Drilling Oil and Gas Wells","13","Oil and gas extraction","B","Mining"
"1382","Oil and Gas Field Exploration Services","13","Oil and gas extraction","B","Mining"
"1389","Oil and Gas Field Services, NEC","13","Oil and gas extraction","B","Mining"
"1411","Dimension Stone","14","Nonmetallic minerals, except fuels","B","Mining"
"1422","Crushed and Broken Limestone","14","Nonmetallic minerals, except fuels","B","Mining"
"1423","Crushed and Broken Granite","14","Nonmetallic minerals, except fuels","B","Mining"
"1429","Crushed and Broken Stone, NEC","14","Nonmetallic minerals, except fuels","B","Mining"
"1442","Construction Sand and Gravel","14","Nonmetallic minerals, except fuels","B","Mining"
"1446","Industrial Sand","14","Nonmetallic minerals, except fuels","B","Mining"
"1455","Kaolin and Ball Clay","14","Nonmetallic minerals, except fuels","B","Mining"
"1459","Clay, Ceramic, and Refractory Minerals, NEC","14","Nonmetallic minerals, except fuels","B","Mining"
"1474","Potash, Soda, and Borate Minerals","14","Nonmetallic minerals, except fuels","B","Mining"
"1475","Phosphate Rock","14","Nonmetallic minerals, except fuels","B","Mining"
"1479","Chemical and Fertilizer Mineral Mining, NEC","14","Nonmetallic minerals, except fuels","B","Mining"
"1481","Nonmetallic Minerals Services Except Fuels","14","Nonmetallic minerals, except fuels","B","Mining"
"1499","Miscellaneous Nonmetallic Minerals, Except","14","Nonmetallic minerals, except fuels","B","Mining"
"1521","General Contractors-Single-Family Houses","15","General building contractors","C","Construction"
"1522","General Contractors-Residential Buildings,","15","General building contractors","C","Construction"
"1531","Operative Builders","15","General building contractors","C","Construction"
"1541","General Contractors-Industrial Buildings and","15","General building contractors","C","Construction"
"1542","General Contractors-Nonresidential Buildings,","15","General building contractors","C","Construction"
"1611","Highway and Street Construction, Except","16","Heavy construction contractors","C","Construction"
"1622","Bridge, Tunnel, and Elevated Highway","16","Heavy construction contractors","C","Construction"
"1623","Water, Sewer, Pipeline, and Communications","16","Heavy construction contractors","C","Construction"
"1629","Heavy Construction, NEC","16","Heavy construction contractors","C","Construction"
"1711","Plumbing, Heating, and Air-Conditioning","17","Special trade contractors","C","Construction"
"1721","Painting and Paper Hanging","17","Special trade contractors","C","Construction"
"1731","Electrical Work","17","Special trade contractors","C","Construction"
"1741","Masonry, Stone Setting, and Other Stone Work","17","Special trade contractors","C","Construction"
"1742","Plastering, Drywall, Acoustical, and","17","Special trade contractors","C","Construction"
"1743","Terrazzo, Tile, Marble, and Mosaic Work","17","Special trade contractors","C","Construction"
"1751","Carpentry Work","17","Special trade contractors","C","Construction"
"1752","Floor Laying and Other Floor Work, NEC","17","Special trade contractors","C","Construction"
"1761","Roofing, Siding, and Sheet Metal Work","17","Special trade contractors","C","Construction"
"1771","Concrete Work","17","Special trade contractors","C","Construction"
"1781","Water Well Drilling","17","Special trade contractors","C","Construction"
"1791","Structural Steel Erection","17","Special trade contractors","C","Construction"
"1793","Glass and Glazing Work","17","Special trade contractors","C","Construction"
"1794","Excavation Work","17","Special trade contractors","C","Construction"
"1795","Wrecking and Demolition Work","17","Special trade contractors","C","Construction"
"1796","Installation or Erection of Building","17","Special trade contractors","C","Construction"
"1799","Special Trade Contractors, NEC","17","Special trade contractors","C","Construction"
"2011","Meat Packing Plants","20","Food and kindred products","D","Manufacturing"
"2013","Sausages and Other Prepared Meats","20","Food and kindred products","D","Manufacturing"
"2015","Poultry Slaughtering and Processing","20","Food and kindred products","D","Manufacturing"
"2021","Creamery Butter","20","Food and kindred products","D","Manufacturing"
"2022","Natural, Processed, and Imitation Cheese","20","Food and kindred products","D","Manufacturing"
"2023","Dry, Condensed, and Evaporated Dairy Products","20","Food and kindred products","D","Manufacturing"
"2024","Ice Cream and Frozen Desserts","20","Food and kindred products","D","Manufacturing"
"2026","Fluid Milk","20","Food and kindred products","D","Manufacturing"
"2032","Canned Specialties","20","Food and kindred products","D","Manufacturing"
"2033","Canned Fruits, Vegetables, Preserves, Jams,","20","Food and kindred products","D","Manufacturing"
"2034","Dried and Dehydrated Fruits, Vegetables, and","20","Food and kindred products","D","Manufacturing"
"2035","Pickled Fruits and Vegetables, Vegetable","20","Food and kindred products","D","Manufacturing"
"2037","Frozen Fruits, Fruit Juices, and Vegetables","20","Food and kindred products","D","Manufacturing"
"2038","Frozen Specialties, NEC","20","Food and kindred products","D","Manufacturing"
"2041","Flour and Other Grain Mill Products","20","Food and kindred products","D","Manufacturing"
"2043","Cereal Breakfast Foods","20","Food and kindred products","D","Manufacturing"
"2044","Rice Milling","20","Food and kindred products","D","Manufacturing"
"2045","Prepared Flour Mixes and Doughs","20","Food and kindred products","D","Manufacturing"
"2046","Wet Corn Milling","20","Food and kindred products","D","Manufacturing"
"2047","Dog and Cat Food","20","Food and kindred products","D","Manufacturing"
"2048","Prepared Feed and Feed Ingredients for","20","Food and kindred products","D","Manufacturing"
"2051","Bread and Other Bakery Products, Except","20","Food and kindred products","D","Manufacturing"
"2052","Cookies and Crackers","20","Food and kindred products","D","Manufacturing"
"2053","Frozen Bakery Products, Except Bread","20","Food and kindred products","D","Manufacturing"
"2061","Cane Sugar, Except Refining","20","Food and kindred products","D","Manufacturing"
"2062","Cane Sugar Refining","20","Food and kindred products","D","Manufacturing"
"2063","Beet Sugar","20","Food and kindred products","D","Manufacturing"
"2064","Candy and Other Confectionery Products","20","Food and kindred products","D","Manufacturing"
"2066","Chocolate and Cocoa Products","20","Food and kindred products","D","Manufacturing"
"2067","Chewing Gum","20","Food and kindred products","D","Manufacturing"
"2068","Salted and Roasted Nuts and Seeds","20","Food and kindred products","D","Manufacturing"
"2074","Cottonseed Oil Mills","20","Food and kindred products","D","Manufacturing"
"2075","Soybean Oil Mills","20","Food and kindred products","D","Manufacturing"
"2076","Vegetable Oil Mills, Except Corn, Cottonseed,","20","Food and kindred products","D","Manufacturing"
"2077","Animal and Marine Fats and Oils","20","Food and kindred products","D","Manufacturing"
"2079","Shortening, Table Oils, Margarine, and Other","20","Food and kindred products","D","Manufacturing"
"2082","Malt Beverages","20","Food and kindred products","D","Manufacturing"
"2083","Malt","20","Food and kindred products","D","Manufacturing"
"2084","Wines, Brandy, and Brandy Spirits","20","Food and kindred products","D","Manufacturing"
"2085","Distilled and Blended Liquors","20","Food and kindred products","D","Manufacturing"
"2086","Bottled and Canned Soft Drinks and Carbonated","20","Food and kindred products","D","Manufacturing"
"2087","Flavoring Extracts and Flavoring Syrups NEC","20","Food and kindred products","D","Manufacturing"
"2091","Canned and Cured Fish and Seafood","20","Food and kindred products","D","Manufacturing"
"2092","Prepared Fresh or Frozen Fish and Seafoods","20","Food and kindred products","D","Manufacturing"
"2095","Roasted Coffee","20","Food and kindred products","D","Manufacturing"
"2096","Potato Chips, Corn Chips, and Similar Snacks","20","Food and kindred products","D","Manufacturing"
"2097","Manufactured Ice","20","Food and kindred products","D","Manufacturing"
"2098","Macaroni, Spaghetti, Vermicelli, and Noodles","20","Food and kindred products","D","Manufacturing"
"2099","Food Preparations, NEC","20","Food and kindred products","D","Manufacturing"
"2111","Cigarettes","21","Tobacco manufactures","D","Manufacturing"
"2121","Cigars","21","Tobacco manufactures","D","Manufacturing"
"2131","Chewing and Smoking Tobacco and Snuff","21","Tobacco manufactures","D","Manufacturing"
"2141","Tobacco Stemming and Redrying","21","Tobacco manufactures","D","Manufacturing"
"2211","Broadwoven Fabric Mills, Cotton","22","Textile mill products","D","Manufacturing"
"2221","Broadwoven Fabric Mills, Manmade Fiber and","22","Textile mill products","D","Manufacturing"
"2231","Broadwoven Fabric Mills, Wool (Including","22","Textile mill products","D","Manufacturing"
"2241","Narrow  Fabric and Other Smallware Mills:","22","Textile mill products","D","Manufacturing"
"2251","Women's Full-Length and Knee-Length Hosiery,","22","Textile mill products","D","Manufacturing"
"2252","Hosiery, NEC","22","Textile mill products","D","Manufacturing"
"2253","Knit Outerwear Mills","22","Textile mill products","D","Manufacturing"
"2254","Knit Underwear and Nightwear Mills","22","Textile mill products","D","Manufacturing"
"2257","Weft Knit Fabric Mills","22","Textile mill products","D","Manufacturing"
"2258","Lace and Warp Knit Fabric Mills","22","Textile mill products","D","Manufacturing"
"2259","Knitting Mills, NEC","22","Textile mill products","D","Manufacturing"
"2261","Finishers of Broadwoven Fabrics of Cotton","22","Textile mill products","D","Manufacturing"
"2262","Finishers of Broadwoven Fabrics of Manmade","22","Textile mill products","D","Manufacturing"
"2269","Finishers of Textiles, NEC","22","Textile mill products","D","Manufacturing"
"2273","Carpets and Rugs","22","Textile mill products","D","Manufacturing"
"2281","Yarn Spinning Mills","22","Textile mill products","D","Manufacturing"
"2282","Yarn Texturizing, Throwing, Twisting, and","22","Textile mill products","D","Manufacturing"
"2284","Thread Mills","22","Textile mill products","D","Manufacturing"
"2295","Coated Fabrics, Not Rubberized","22","Textile mill products","D","Manufacturing"
"2296","Tire Cord and Fabrics","22","Textile mill products","D","Manufacturing"
"2297","Nonwoven Fabrics","22","Textile mill products","D","Manufacturing"
"2298","Cordage and Twine","22","Textile mill products","D","Manufacturing"
"2299","Textile Goods, NEC","22","Textile mill products","D","Manufacturing"
"2311","Men's and Boys' Suits, Coats, and Overcoats","23","Apparel and other textile products","D","Manufacturing"
"2321","Men's and Boys' Shirts, Except Work Shirts","23","Apparel and other textile products","D","Manufacturing"
"2322","Men's and Boys' Underwear and Nightwear","23","Apparel and other textile products","D","Manufacturing"
"2323","Men's and Boys' Neckwear","23","Apparel and other textile products","D","Manufacturing"
"2325","Men's and Boys' Trousers and Slacks","23","Apparel and other textile products","D","Manufacturing"
"2326","Men's and Boys' Work Clothing","23","Apparel and other textile products","D","Manufacturing"
"2329","Men's and Boys' Clothing, NEC","23","Apparel and other textile products","D","Manufacturing"
"2331","Women's, Misses', and Juniors' Blouses and","23","Apparel and other textile products","D","Manufacturing"
"2335","Women's, Misses', and Juniors' Dresses","23","Apparel and other textile products","D","Manufacturing"
"2337","Women's, Misses' and Juniors' Suits, Skirts,","23","Apparel and other textile products","D","Manufacturing"
"2339","Women's, Misses', and Juniors' Outerwear, NEC","23","Apparel and other textile products","D","Manufacturing"
"2341","Women's, Misses', Children's, and Infants'","23","Apparel and other textile products","D","Manufacturing"
"2342","Brassieres, Girdles, and Allied Garments","23","Apparel and other textile products","D","Manufacturing"
"2353","Hats, Caps, and Millinery","23","Apparel and other textile products","D","Manufacturing"
"2361","Girls', Children's, and Infants' Dresses,","23","Apparel and other textile products","D","Manufacturing"
"2369","Girls', Children's, and Infants' Outerwear,","23","Apparel and other textile products","D","Manufacturing"
"2371","Fur Goods","23","Apparel and other textile products","D","Manufacturing"
"2381","Dress and Work Gloves, Except Knit and","23","Apparel and other textile products","D","Manufacturing"
"2384","Robes and Dressing Gowns","23","Apparel and other textile products","D","Manufacturing"
"2385","Waterproof Outerwear","23","Apparel and other textile products","D","Manufacturing"
"2386","Leather and Sheep-Lined Clothing","23","Apparel and other textile products","D","Manufacturing"
"2387","Apparel Belts","23","Apparel and other textile products","D","Manufacturing"
"2389","Apparel and Accessories, NEC","23","Apparel and other textile products","D","Manufacturing"
"2391","Curtains and Draperies","23","Apparel and other textile products","D","Manufacturing"
"2392","Housefurnishings, Except Curtains and","23","Apparel and other textile products","D","Manufacturing"
"2393","Textile Bags","23","Apparel and other textile products","D","Manufacturing"
"2394","Canvas and Related Products","23","Apparel and other textile products","D","Manufacturing"
"2395","Pleating, Decorative and Novelty Stitching,","23","Apparel and other textile products","D","Manufacturing"
"2396","Automotive Trimmings, Apparel Findings, and","23","Apparel and other textile products","D","Manufacturing"
"2397","Schiffli Machine Embroideries","23","Apparel and other textile products","D","Manufacturing"
"2399","Fabricated Textile Products, NEC","23","Apparel and other textile products","D","Manufacturing"
"2411","Logging","24","Lumber and wood products","D","Manufacturing"
"2421","Sawmills and Planing Mills, General","24","Lumber and wood products","D","Manufacturing"
"2426","Hardwood Dimension and Flooring Mills","24","Lumber and wood products","D","Manufacturing"
"2429","Special Product Sawmills, NEC","24","Lumber and wood products","D","Manufacturing"
"2431","Millwork","24","Lumber and wood products","D","Manufacturing"
"2434","Wood Kitchen Cabinets","24","Lumber and wood products","D","Manufacturing"
"2435","Hardwood Veneer and Plywood","24","Lumber and wood products","D","Manufacturing"
"2436","Softwood Veneer and Plywood","24","Lumber and wood products","D","Manufacturing"
"2439","Structural Wood Members, NEC","24","Lumber and wood products","D","Manufacturing"
"2441","Nailed and Lock Corner Wood Boxes and Shook","24","Lumber and wood products","D","Manufacturing"
"2448","Wood Pallets and Skids","24","Lumber and wood products","D","Manufacturing"
"2449","Wood Containers, NEC","24","Lumber and wood products","D","Manufacturing"
"2451","Mobile Homes","24","Lumber and wood products","D","Manufacturing"
"2452","Prefabricated Wood Buildings and Components","24","Lumber and wood products","D","Manufacturing"
"2491","Wood Preserving","24","Lumber and wood products","D","Manufacturing"
"2493","Reconstituted Wood Products","24","Lumber and wood products","D","Manufacturing"
"2499","Wood Products, NEC","24","Lumber and wood products","D","Manufacturing"
"2511","Wood Household Furniture, Except Upholstered","25","Furniture and fixtures","D","Manufacturing"
"2512","Wood Household Furniture, Upholstered","25","Furniture and fixtures","D","Manufacturing"
"2514","Metal Household Furniture","25","Furniture and fixtures","D","Manufacturing"
"2515","Mattresses, Foundations, and Convertible Beds","25","Furniture and fixtures","D","Manufacturing"
"2517","Wood Television, Radio, Phonograph and Sewing","25","Furniture and fixtures","D","Manufacturing"
"2519","Household Furniture, NEC","25","Furniture and fixtures","D","Manufacturing"
"2521","Wood Office Furniture","25","Furniture and fixtures","D","Manufacturing"
"2522","Office Furniture, Except Wood","25","Furniture and fixtures","D","Manufacturing"
"2531","Public Building and Related Furniture","25","Furniture and fixtures","D","Manufacturing"
"2541","Wood Office and Store Fixtures, Partitions,","25","Furniture and fixtures","D","Manufacturing"
"2542","Office and Store Fixtures, Partitions,","25","Furniture and fixtures","D","Manufacturing"
"2591","Drapery Hardware and Window Blinds and Shades","25","Furniture and fixtures","D","Manufacturing"
"2599","Furniture and Fixtures, NEC","25","Furniture and fixtures","D","Manufacturing"
"2611","Pulp Mills","26","Paper and allied products","D","Manufacturing"
"2621","Paper Mills","26","Paper and allied products","D","Manufacturing"
"2631","Paperboard Mills","26","Paper and allied products","D","Manufacturing"
"2652","Setup Paperboard Boxes","26","Paper and allied products","D","Manufacturing"
"2653","Corrugated and Solid Fiber Boxes","26","Paper and allied products","D","Manufacturing"
"2655","Fiber Cans, Tubes, Drums, and Similar","26","Paper and allied products","D","Manufacturing"
"2656","Sanitary Food Containers, Except Folding","26","Paper and allied products","D","Manufacturing"
"2657","Folding Paperboard Boxes, Including Sanitary","26","Paper and allied products","D","Manufacturing"
"2671","Packaging Paper and Plastics Film, Coated and","26","Paper and allied products","D","Manufacturing"
"2672","Coated and Laminated Paper, NEC","26","Paper and allied products","D","Manufacturing"
"2673","Plastics, Foil, and Coated Paper Bags","26","Paper and allied products","D","Manufacturing"
"2674","Uncoated Paper and Multiwall Bags","26","Paper and allied products","D","Manufacturing"
"2675","Die-Cut Paper and Paperboard and Cardboard","26","Paper and allied products","D","Manufacturing"
"2676","Sanitary Paper Products","26","Paper and allied products","D","Manufacturing"
"2677","Envelopes","26","Paper and allied products","D","Manufacturing"
"2678","Stationery, Tablets, and Related Products","26","Paper and allied products","D","Manufacturing"
