"3728","Aircraft Parts and Auxiliary Equipment, NEC","37","Transportation equipment","D","Manufacturing"
"3731","Ship Building and Repairing","37","Transportation equipment","D","Manufacturing"
"3732","Boat  Building and Repairing","37","Transportation equipment","D","Manufacturing"
"3743","Railroad Equipment","37","Transportation equipment","D","Manufacturing"
"3751","Motorcycles, Bicycles, and Parts","37","Transportation equipment","D","Manufacturing"
"3761","Guided Missiles and Space Vehicles","37","Transportation equipment","D","Manufacturing"
"3764","Guided Missile and Space Vehicle Propulsion","37","Transportation equipment","D","Manufacturing"
"3769","Guided Missile Space Vehicle Parts and","37","Transportation equipment","D","Manufacturing"
"3792","Travel Trailers and Campers","37","Transportation equipment","D","Manufacturing"
"3795","Tanks and Tank Components","37","Transportation equipment","D","Manufacturing"
"3799","Transportation Equipment, NEC","37","Transportation equipment","D","Manufacturing"
"3812","Search, Detection, Navigation, Guidance,","38","Instruments and related products","D","Manufacturing"
"3821","Laboratory Apparatus and Furniture","38","Instruments and related products","D","Manufacturing"
"3822","Automatic Controls for Regulating Residential","38","Instruments and related products","D","Manufacturing"
"3823","Industrial Instruments for Measurement,","38","Instruments and related products","D","Manufacturing"
"3824","Totalizing Fluid Meters and Counting Devices","38","Instruments and related products","D","Manufacturing"
"3825","Instruments for Measuring and Testing of","38","Instruments and related products","D","Manufacturing"
"3826","Laboratory Analytical Instruments","38","Instruments and related products","D","Manufacturing"
"3827","Optical Instruments and Lenses","38","Instruments and related products","D","Manufacturing"
"3829","Measuring and Controlling Devices, NEC","38","Instruments and related products","D","Manufacturing"
"3841","Surgical and Medical Instruments and","38","Instruments and related products","D","Manufacturing"
"3842","Orthopedic, Prosthetic, and Surgical","38","Instruments and related products","D","Manufacturing"
"3843","Dental Equipment and Supplies","38","Instruments and related products","D","Manufacturing"
"3844","X-Ray Apparatus and Tubes and Related","38","Instruments and related products","D","Manufacturing"
"3845","Electromedical and Electrotherapeutic","38","Instruments and related products","D","Manufacturing"
"3851","Ophthalmic Goods","38","Instruments and related products","D","Manufacturing"
"3861","Photographic Equipment and Supplies","38","Instruments and related products","D","Manufacturing"
"3873","Watches, Clocks, Clockwork Operated Devices","38","Instruments and related products","D","Manufacturing"
"3911","Jewelry, Precious Metal","39","Miscellaneous manufacturing industries","D","Manufacturing"
"3914","Silverware, Plated Ware, and Stainless Steel","39","Miscellaneous manufacturing industries","D","Manufacturing"
"3915","Jewelers' Findings and Materials, and","39","Miscellaneous manufacturing industries","D","Manufacturing"
"3931","Musical Instruments","39","Miscellaneous manufacturing industries","D","Manufacturing"
"3942","Dolls and Stuffed Toys","39","Miscellaneous manufacturing industries","D","Manufacturing"
"3944","Games, Toys, and Children's Vehicles, Except","39","Miscellaneous manufacturing industries","D","Manufacturing"
"3949","Sporting and Athletic Goods, NEC","39","Miscellaneous manufacturing industries","D","Manufacturing"
"3951","Pens, Mechanical Pencils, and Parts","39","Miscellaneous manufacturing industries","D","Manufacturing"
"3952","Lead Pencils, Crayons, and Artist's Materials","39","Miscellaneous manufacturing industries","D","Manufacturing"
"3953","Marking Devices","39","Miscellaneous manufacturing industries","D","Manufacturing"
"3955","Carbon Paper and Inked Ribbons","39","Miscellaneous manufacturing industries","D","Manufacturing"
"3961","Costume Jewelry and Costume Novelties, Except","39","Miscellaneous manufacturing industries","D","Manufacturing"
"3965","Fasteners, Buttons, Needles, and Pins","39","Miscellaneous manufacturing industries","D","Manufacturing"
"3991","Brooms and Brushes","39","Miscellaneous manufacturing industries","D","Manufacturing"
"3993","Signs and Advertising Specialties","39","Miscellaneous manufacturing industries","D","Manufacturing"
"3995","Burial Caskets","39","Miscellaneous manufacturing industries","D","Manufacturing"
"3996","Linoleum, Asphalted-Felt-Base, and Other Hard","39","Miscellaneous manufacturing industries","D","Manufacturing"
"3999","Manufacturing Industries, NEC","39","Miscellaneous manufacturing industries","D","Manufacturing"
"4011","Railroads, Line-haul Operating","40","Railroads","E","Transportation, Communications, Electric, Gas, And Sanitary Services "
"4013","Railroad Switching and Terminal","40","Railroads","E","Transportation, Communications, Electric, Gas, And Sanitary Services "
"4111","Local and Suburban Transit","41","Local and interurban passenger transit","E","Transportation, Communications, Electric, Gas, And Sanitary Services "
"4119","Local Passenger Transportation, NEC","41","Local and interurban passenger transit","E","Transportation, Communications, Electric, Gas, And Sanitary Services "
"4121","Taxicabs","41","Local and interurban passenger transit","E","Transportation, Communications, Electric, Gas, And Sanitary Services "
"4131","Intercity and Rural Bus Transportation","41","Local and interurban passenger transit","E","Transportation, Communications, Electric, Gas, And Sanitary Services "
"4141","Local Bus Charter Service","41","Local and interurban passenger transit","E","Transportation, Communications, Electric, Gas, And Sanitary Services "
"4142","Bus Charter Service, Except Local","41","Local and interurban passenger transit","E","Transportation, Communications, Electric, Gas, And Sanitary Services "
"4151","School Buses","41","Local and interurban passenger transit","E","Transportation, Communications, Electric, Gas, And Sanitary Services "
"4173","Terminal and Service Facilities for Motor","41","Local and interurban passenger transit","E","Transportation, Communications, Electric, Gas, And Sanitary Services "
"4212","Local Trucking Without Storage","42","Motor freight transportation and warehousing","E","Transportation, Communications, Electric, Gas, And Sanitary Services "
"4213","Trucking, Except Local","42","Motor freight transportation and warehousing","E","Transportation, Communications, Electric, Gas, And Sanitary Services "
"4214","Local Trucking with Storage","42","Motor freight transportation and warehousing","E","Transportation, Communications, Electric, Gas, And Sanitary Services "
"4215","Courier Services Except by Air","42","Motor freight transportation and warehousing","E","Transportation, Communications, Electric, Gas, And Sanitary Services "
"4221","Farm Product Warehousing and Storage","42","Motor freight transportation and warehousing","E","Transportation, Communications, Electric, Gas, And Sanitary Services "
"4222","Refrigerated Warehousing and Storage","42","Motor freight transportation and warehousing","E","Transportation, Communications, Electric, Gas, And Sanitary Services "
"4225","General Warehousing and Storage","42","Motor freight transportation and warehousing","E","Transportation, Communications, Electric, Gas, And Sanitary Services "
"4226","Special Warehousing and Storage, NEC","42","Motor freight transportation and warehousing","E","Transportation, Communications, Electric, Gas, And Sanitary Services "
"4231","Terminal and Joint Terminal Maintenance","42","Motor freight transportation and warehousing","E","Transportation, Communications, Electric, Gas, And Sanitary Services "
"4311","United States Postal Service","43","U.S. Postal Service","E","Transportation, Communications, Electric, Gas, And Sanitary Services "
"4412","Deep Sea Foreign Transportation of  Freight","44","Water transportation","E","Transportation, Communications, Electric, Gas, And Sanitary Services "
"4424","Deep Sea Domestic Transportation of Freight","44","Water transportation","E","Transportation, Communications, Electric, Gas, And Sanitary Services "
"4432","Freight Transportation on the Great Lakes -","44","Water transportation","E","Transportation, Communications, Electric, Gas, And Sanitary Services "
"4449","Water Transportation of Freight, NEC","44","Water transportation","E","Transportation, Communications, Electric, Gas, And Sanitary Services "
"4481","Deep Sea Transportation of Passengers, Except","44","Water transportation","E","Transportation, Communications, Electric, Gas, And Sanitary Services "
"4482","Ferries","44","Water transportation","E","Transportation, Communications, Electric, Gas, And Sanitary Services "
"4489","Water Transportation of Passengers, NEC","44","Water transportation","E","Transportation, Communications, Electric, Gas, And Sanitary Services "
"4491","Marine Cargo Handling","44","Water transportation","E","Transportation, Communications, Electric, Gas, And Sanitary Services "
"4492","Towing and Tugboat Services","44","Water transportation","E","Transportation, Communications, Electric, Gas, And Sanitary Services "
"4493","Marinas","44","Water transportation","E","Transportation, Communications, Electric, Gas, And Sanitary Services "
"4499","Water Transportation Services, NEC","44","Water transportation","E","Transportation, Communications, Electric, Gas, And Sanitary Services "
"4512","Air Transportation, Scheduled","45","Transportation by air","E","Transportation, Communications, Electric, Gas, And Sanitary Services "
"4513","Air Courier Services","45","Transportation by air","E","Transportation, Communications, Electric, Gas, And Sanitary Services "
"4522","Air Transportation, Nonscheduled","45","Transportation by air","E","Transportation, Communications, Electric, Gas, And Sanitary Services "
"4581","Airports, Flying Fields, and Airport Terminal","45","Transportation by air","E","Transportation, Communications, Electric, Gas, And Sanitary Services "
"4612","Crude Petroleum Pipelines","46","Pipelines, except natural gas","E","Transportation, Communications, Electric, Gas, And Sanitary Services "
"4613","Refined Petroleum Pipelines","46","Pipelines, except natural gas","E","Transportation, Communications, Electric, Gas, And Sanitary Services "
"4619","Pipelines, NEC","46","Pipelines, except natural gas","E","Transportation, Communications, Electric, Gas, And Sanitary Services "
"4724","Travel Agencies","47","Transportation services","E","Transportation, Communications, Electric, Gas, And Sanitary Services "
"4725","Tour Operators","47","Transportation services","E","Transportation, Communications, Electric, Gas, And Sanitary Services "
"4729","Arrangement of Passenger Transportation, NEC","47","Transportation services","E","Transportation, Communications, Electric, Gas, And Sanitary Services "
"4731","Arrangement of Transportation of  Freight and","47","Transportation services","E","Transportation, Communications, Electric, Gas, And Sanitary Services "
"4741","Rental of Railroad Cars","47","Transportation services","E","Transportation, Communications, Electric, Gas, And Sanitary Services "
"4783","Packing and Crating","47","Transportation services","E","Transportation, Communications, Electric, Gas, And Sanitary Services "
"4785","Fixed Facilities and Inspection and Weighing","47","Transportation services","E","Transportation, Communications, Electric, Gas, And Sanitary Services "
"4789","Transportation Services, NEC","47","Transportation services","E","Transportation, Communications, Electric, Gas, And Sanitary Services "
"4812","Radiotelephone Communications","48","Communications","E","Transportation, Communications, Electric, Gas, And Sanitary Services "
"4813","Telephone Communications, Except","48","Communications","E","Transportation, Communications, Electric, Gas, And Sanitary Services "
"4822","Telegraph and Other  Message Communications","48","Communications","E","Transportation, Communications, Electric, Gas, And Sanitary Services "
"4832","Radio Broadcasting Stations","48","Communications","E","Transportation, Communications, Electric, Gas, And Sanitary Services "
"4833","Television Broadcasting Stations","48","Communications","E","Transportation, Communications, Electric, Gas, And Sanitary Services "
"4841","Cable and Other Pay Television Services","48","Communications","E","Transportation, Communications, Electric, Gas, And Sanitary Services "
"4899","Communications Services, NEC","48","Communications","E","Transportation, Communications, Electric, Gas, And Sanitary Services "
"4911","Electric Services","49","Electric, gas, and sanitary services","E","Transportation, Communications, Electric, Gas, And Sanitary Services "
"4922","Natural Gas Transmission","49","Electric, gas, and sanitary services","E","Transportation, Communications, Electric, Gas, And Sanitary Services "
"4923","Natural Gas Transmission and Distribution","49","Electric, gas, and sanitary services","E","Transportation, Communications, Electric, Gas, And Sanitary Services "
"4924","Natural Gas Distribution","49","Electric, gas, and sanitary services","E","Transportation, Communications, Electric, Gas, And Sanitary Services "
"4925","Mixed, Manufactured, or Liquefied Petroleum","49","Electric, gas, and sanitary services","E","Transportation, Communications, Electric, Gas, And Sanitary Services "
"4931","Electric and Other Services Combined","49","Electric, gas, and sanitary services","E","Transportation, Communications, Electric, Gas, And Sanitary Services "
"4932","Gas and Other Services Combined","49","Electric, gas, and sanitary services","E","Transportation, Communications, Electric, Gas, And Sanitary Services "
"4939","Combination Utilities, NEC","49","Electric, gas, and sanitary services","E","Transportation, Communications, Electric, Gas, And Sanitary Services "
"4941","Water Supply","49","Electric, gas, and sanitary services","E","Transportation, Communications, Electric, Gas, And Sanitary Services "
"4952","Sewerage Systems","49","Electric, gas, and sanitary services","E","Transportation, Communications, Electric, Gas, And Sanitary Services "
"4953","Refuse Systems","49","Electric, gas, and sanitary services","E","Transportation, Communications, Electric, Gas, And Sanitary Services "
"4959","Sanitary Services, NEC","49","Electric, gas, and sanitary services","E","Transportation, Communications, Electric, Gas, And Sanitary Services "
"4961","Steam and Air-Conditioning Supply","49","Electric, gas, and sanitary services","E","Transportation, Communications, Electric, Gas, And Sanitary Services "
"4971","Irrigation Systems","49","Electric, gas, and sanitary services","E","Transportation, Communications, Electric, Gas, And Sanitary Services "
"5012","Automobiles and Other Motor Vehicles","50","Wholesale trade--durable goods","F","Wholesale Trade"
"5013","Motor Vehicle Supplies and New Parts","50","Wholesale trade--durable goods","F","Wholesale Trade"
"5014","Tires and Tubes","50","Wholesale trade--durable goods","F","Wholesale Trade"
"5015","Motor Vehicle Parts, Used","50","Wholesale trade--durable goods","F","Wholesale Trade"
"5021","Furniture","50","Wholesale trade--durable goods","F","Wholesale Trade"
"5023","Home Furnishings","50","Wholesale trade--durable goods","F","Wholesale Trade"
"5031","Lumber, Plywood, Millwork, and Wood Panels","50","Wholesale trade--durable goods","F","Wholesale Trade"
"5032","Brick, Stone and Related Construction","50","Wholesale trade--durable goods","F","Wholesale Trade"
"5033","Roofing, Siding, and Insulation Materials","50","Wholesale trade--durable goods","F","Wholesale Trade"
"5039","Construction Materials, NEC","50","Wholesale trade--durable goods","F","Wholesale Trade"
"5043","Photographic Equipment and Supplies","50","Wholesale trade--durable goods","F","Wholesale Trade"
"5044","Office Equipment","50","Wholesale trade--durable goods","F","Wholesale Trade"
"5045","Computers and Computer Peripheral Equipment","50","Wholesale trade--durable goods","F","Wholesale Trade"
"5046","Commercial Equipment, NEC","50","Wholesale trade--durable goods","F","Wholesale Trade"
"5047","Medical, Dental, and Hospital Equipment and","50","Wholesale trade--durable goods","F","Wholesale Trade"
"5048","Ophthalmic Goods","50","Wholesale trade--durable goods","F","Wholesale Trade"
"5049","Professional Equipment and Supplies, NEC","50","Wholesale trade--durable goods","F","Wholesale Trade"
"5051","Metals Service Centers and Offices","50","Wholesale trade--durable goods","F","Wholesale Trade"
"5052","Coal and Other Minerals and Ores","50","Wholesale trade--durable goods","F","Wholesale Trade"
"5063","Electrical Apparatus and Equipment Wiring","50","Wholesale trade--durable goods","F","Wholesale Trade"
"5064","Electrical Appliances, Television and Radio","50","Wholesale trade--durable goods","F","Wholesale Trade"
"5065","Electronic Parts and Equipment, NEC","50","Wholesale trade--durable goods","F","Wholesale Trade"
"5072","Hardware","50","Wholesale trade--durable goods","F","Wholesale Trade"
"5074","Plumbing and Heating Equipment and Supplies","50","Wholesale trade--durable goods","F","Wholesale Trade"
"5075","Warm Air Heating and Air-Conditioning","50","Wholesale trade--durable goods","F","Wholesale Trade"
"5078","Refrigeration Equipment and Supplies","50","Wholesale trade--durable goods","F","Wholesale Trade"
"5082","Construction and Mining (Except Petroleum)","50","Wholesale trade--durable goods","F","Wholesale Trade"
"5083","Farm and Garden Machinery and Equipment","50","Wholesale trade--durable goods","F","Wholesale Trade"
"5084","Industrial Machinery and Equipment","50","Wholesale trade--durable goods","F","Wholesale Trade"
"5085","Industrial Supplies","50","Wholesale trade--durable goods","F","Wholesale Trade"
"5087","Service Establishment Equipment and Supplies","50","Wholesale trade--durable goods","F","Wholesale Trade"
"5088","Transportation Equipment and Supplies, Except","50","Wholesale trade--durable goods","F","Wholesale Trade"
"5091","Sporting and Recreational Goods and Supplies","50","Wholesale trade--durable goods","F","Wholesale Trade"
"5092","Toys and Hobby Goods and Supplies","50","Wholesale trade--durable goods","F","Wholesale Trade"
"5093","Scrap and Waste Materials","50","Wholesale trade--durable goods","F","Wholesale Trade"
"5094","Jewelry, Watches, Precious Stones, and","50","Wholesale trade--durable goods","F","Wholesale Trade"
"5099","Durable Goods, NEC","50","Wholesale trade--durable goods","F","Wholesale Trade"
"5111","Printing and Writing Paper","51","Wholesale trade--nondurable goods","F","Wholesale Trade"
"5112","Stationery and Office Supplies","51","Wholesale trade--nondurable goods","F","Wholesale Trade"
"5113","Industrial and Personal Service Paper","51","Wholesale trade--nondurable goods","F","Wholesale Trade"
"5122","Drugs, Drug Proprietaries, and Druggists'","51","Wholesale trade--nondurable goods","F","Wholesale Trade"
"5131","Piece Goods, Notions, and Other Dry Goods","51","Wholesale trade--nondurable goods","F","Wholesale Trade"
"5136","Men's and Boys' Clothing and Furnishings","51","Wholesale trade--nondurable goods","F","Wholesale Trade"
"5137","Women's, Children's, and Infants' Clothing","51","Wholesale trade--nondurable goods","F","Wholesale Trade"
"5139","Footwear","51","Wholesale trade--nondurable goods","F","Wholesale Trade"
"5141","Groceries, General Line","51","Wholesale trade--nondurable goods","F","Wholesale Trade"
"5142","Packaged Frozen Foods","51","Wholesale trade--nondurable goods","F","Wholesale Trade"
"5143","Dairy Products, Except Dried or Canned","51","Wholesale trade--nondurable goods","F","Wholesale Trade"
"5144","Poultry and Poultry Products","51","Wholesale trade--nondurable goods","F","Wholesale Trade"
"5145","Confectionery","51","Wholesale trade--nondurable goods","F","Wholesale Trade"
"5146","Fish and Seafoods","51","Wholesale trade--nondurable goods","F","Wholesale Trade"
"5147","Meats and Meat Products","51","Wholesale trade--nondurable goods","F","Wholesale Trade"
"5148","Fresh Fruits and Vegetables","51","Wholesale trade--nondurable goods","F","Wholesale Trade"
"5149","Groceries and Related Products, NEC","51","Wholesale trade--nondurable goods","F","Wholesale Trade"
"5153","Grain and Field Beans","51","Wholesale trade--nondurable goods","F","Wholesale Trade"
"5154","Livestock","51","Wholesale trade--nondurable goods","F","Wholesale Trade"
"5159","Farm-Product Raw Materials, NEC","51","Wholesale trade--nondurable goods","F","Wholesale Trade"
"5162","Plastics Materials and Basic Forms and Shapes","51","Wholesale trade--nondurable goods","F","Wholesale Trade"
"5169","Chemicals and Allied Products, NEC","51","Wholesale trade--nondurable goods","F","Wholesale Trade"
"5171","Petroleum Bulk Stations and Terminals","51","Wholesale trade--nondurable goods","F","Wholesale Trade"
"5172","Petroleum and Petroleum Products Wholesalers,","51","Wholesale trade--nondurable goods","F","Wholesale Trade"
"5181","Beer and Ale","51","Wholesale trade--nondurable goods","F","Wholesale Trade"
"5182","Wine and Distilled Alcoholic Beverages","51","Wholesale trade--nondurable goods","F","Wholesale Trade"
"5191","Farm Supplies","51","Wholesale trade--nondurable goods","F","Wholesale Trade"
"5192","Books, Periodicals, and Newspapers","51","Wholesale trade--nondurable goods","F","Wholesale Trade"
"5193","Flowers, Nursery Stock, and Florists'","51","Wholesale trade--nondurable goods","F","Wholesale Trade"
"5194","Tobacco and Tobacco Products","51","Wholesale trade--nondurable goods","F","Wholesale Trade"
"5198","Paint, Varnishes, and Supplies","51","Wholesale trade--nondurable goods","F","Wholesale Trade"
"5199","Nondurable Goods, NEC","51","Wholesale trade--nondurable goods","F","Wholesale Trade"
"5211","Lumber and Other Building Materials Dealers","52","Building materials, hardware, garden supply","G","Retail Trade"
"5231","Paint, Glass, and Wallpaper Stores","52","Building materials, hardware, garden supply","G","Retail Trade"
"5251","Hardware Stores","52","Building materials, hardware, garden supply","G","Retail Trade"
"5261","Retail Nurseries, Lawn and Garden Supply","52","Building materials, hardware, garden supply","G","Retail Trade"
"5271","Mobile Home Dealers","52","Building materials, hardware, garden supply","G","Retail Trade"
"5311","Department Stores","53","General merchandise stores","G","Retail Trade"
"5331","Variety Stores","53","General merchandise stores","G","Retail Trade"
"5399","Miscellaneous General Merchandise Stores","53","General merchandise stores","G","Retail Trade"
"5411","Grocery Stores","54","Food stores","G","Retail Trade"
"5421","Meat and Fish (Seafood) Markets, Including","54","Food stores","G","Retail Trade"
"5431","Fruit and Vegetable Markets","54","Food stores","G","Retail Trade"
"5441","Candy, Nut, and Confectionery Stores","54","Food stores","G","Retail Trade"
"5451","Dairy Products Stores","54","Food stores","G","Retail Trade"
"5461","Retail Bakeries","54","Food stores","G","Retail Trade"
"5499","Miscellaneous Food Stores","54","Food stores","G","Retail Trade"
"5511","Motor Vehicle Dealers (New and Used)","55","Automotive dealers and gasoline service","G","Retail Trade"
"5521","Motor Vehicle Dealers (Used Only)","55","Automotive dealers and gasoline service","G","Retail Trade"
"5531","Auto and Home Supply Stores","55","Automotive dealers and gasoline service","G","Retail Trade"
"5541","Gasoline Service Stations","55","Automotive dealers and gasoline service","G","Retail Trade"
"5551","Boat Dealers","55","Automotive dealers and gasoline service","G","Retail Trade"
"5561","Recreational Vehicle Dealers","55","Automotive dealers and gasoline service","G","Retail Trade"
"5571","Motorcycle Dealers","55","Automotive dealers and gasoline service","G","Retail Trade"
"5599","Automotive Dealers, NEC","55","Automotive dealers and gasoline service","G","Retail Trade"
"5611","Men's and Boys' Clothing and Accessory Stores","56","Apparel and accessory stores","G","Retail Trade"
"5621","Women's Clothing Stores","56","Apparel and accessory stores","G","Retail Trade"
"5632","Women's Accessory and Specialty Stores","56","Apparel and accessory stores","G","Retail Trade"
"5641","Children's and Infants' Wear Stores","56","Apparel and accessory stores","G","Retail Trade"
"5651","Family Clothing Stores","56","Apparel and accessory stores","G","Retail Trade"
"5661","Shoe Stores","56","Apparel and accessory stores","G","Retail Trade"
"5699","Miscellaneous Apparel and Accessory Stores","56","Apparel and accessory stores","G","Retail Trade"
"5712","Furniture Stores","57","Furniture, home furnishings and equipment","G","Retail Trade"
"5713","Floor Covering Stores","57","Furniture, home furnishings and equipment","G","Retail Trade"
"5714","Drapery, Curtain, and Upholstery Stores","57","Furniture, home furnishings and equipment","G","Retail Trade"
"5719","Miscellaneous Homefurnishings Stores","57","Furniture, home furnishings and equipment","G","Retail Trade"
"5722","Household Appliance Stores","57","Furniture, home furnishings and equipment","G","Retail Trade"
"5731","Radio, Television, and Consumer Electronics","57","Furniture, home furnishings and equipment","G","Retail Trade"
"5734","Computer and Computer Software Stores","57","Furniture, home furnishings and equipment","G","Retail Trade"
"5735","Record and Prerecorded Tape Stores","57","Furniture, home furnishings and equipment","G","Retail Trade"
"5736","Musical Instrument Stores","57","Furniture, home furnishings and equipment","G","Retail Trade"
